Microsoft Windows [Version 10.0.16299.726]
(c) 2017 Microsoft Corporation. All rights reserved.

C:\Users\Jey Fawker's>cd c:/xampp/mysql/bin/mysql.exe -u root
The system cannot find the path specified.

C:\Users\Jey Fawker's>cd c:/xampp/mysql/bin

c:\xampp\mysql\bin>mysql.exe -u root
Welcome to the MariaDB monitor.  Commands end with ; or \g.
Your MariaDB connection id is 71
Server version: 10.1.31-MariaDB mariadb.org binary distribution

Copyright (c) 2000, 2018, Oracle, MariaDB Corporation Ab and others.

Type 'help;' or '\h' for help. Type '\c' to clear the current input statement.

MariaDB [(none)]> show databases;
+--------------------+
| Database           |
+--------------------+
| information_schema |
| latihan            |
| latihan01          |
| latihan02          |
| latihan03          |
| mahasiswa01        |
| mysql              |
| pegawi             |
| performance_schema |
| phpmyadmin         |
| praktikum04        |
+--------------------+
11 rows in set (0.00 sec)

MariaDB [(none)]> use mahasiswa01;
Database changed
MariaDB [mahasiswa01]> select*from data_mahasiswa;
+-----------+---------------+---------------+---------------+--------------+----------+----------+-------+------------+
| Nim       | Nama          | Tanggal_lahir | Jenis_kelamin | Alamat_jalan | Kota     | Kode_Pos | No_Hp | Kode_Dosen |
+-----------+---------------+---------------+---------------+--------------+----------+----------+-------+------------+
| 112334401 | Ari Santoso   | 1979-08-31    | Laki-laki     |              | BEKASI   |        0 |       | TI-032     |
| 112334402 | Ario Talib    | 1999-11-16    | Laki-laki     |              | Cikarang |        0 |       | TI-001     |
| 112334404 | Lisa Ayu      | 1996-01-02    | Perempuan     |              | Bekasi   |        0 |       | TL-023     |
| 112334405 | Tiara Wahidah | 1980-02-05    | Perempuan     |              | BEKASI   |        0 |       | TI-010     |
| 112334406 | Anton Sinaga  | 1988-03-10    | Laki-Laki     |              | Cikarang |        0 |       | TL-020     |
+-----------+---------------+---------------+---------------+--------------+----------+----------+-------+------------+
5 rows in set (0.00 sec)

MariaDB [mahasiswa01]> update data_mahasiswa set Tanggal_lahir= '1998-10-12' where nim = '112334401';
Query OK, 1 row affected (0.16 sec)
Rows matched: 1  Changed: 1  Warnings: 0

MariaDB [mahasiswa01]> select*from data_mahasiswa;
+-----------+---------------+---------------+---------------+--------------+----------+----------+-------+------------+
| Nim       | Nama          | Tanggal_lahir | Jenis_kelamin | Alamat_jalan | Kota     | Kode_Pos | No_Hp | Kode_Dosen |
+-----------+---------------+---------------+---------------+--------------+----------+----------+-------+------------+
| 112334401 | Ari Santoso   | 1998-10-12    | Laki-laki     |              | BEKASI   |        0 |       | TI-032     |
| 112334402 | Ario Talib    | 1999-11-16    | Laki-laki     |              | Cikarang |        0 |       | TI-001     |
| 112334404 | Lisa Ayu      | 1996-01-02    | Perempuan     |              | Bekasi   |        0 |       | TL-023     |
| 112334405 | Tiara Wahidah | 1980-02-05    | Perempuan     |              | BEKASI   |        0 |       | TI-010     |
| 112334406 | Anton Sinaga  | 1988-03-10    | Laki-Laki     |              | Cikarang |        0 |       | TL-020     |
+-----------+---------------+---------------+---------------+--------------+----------+----------+-------+------------+
5 rows in set (0.00 sec)

MariaDB [mahasiswa01]> select*from data_mahasiswa where nim ='112334401';
+-----------+-------------+---------------+---------------+--------------+--------+----------+-------+------------+
| Nim       | Nama        | Tanggal_lahir | Jenis_kelamin | Alamat_jalan | Kota   | Kode_Pos | No_Hp | Kode_Dosen |
+-----------+-------------+---------------+---------------+--------------+--------+----------+-------+------------+
| 112334401 | Ari Santoso | 1998-10-12    | Laki-laki     |              | BEKASI |        0 |       | TI-032     |
+-----------+-------------+---------------+---------------+--------------+--------+----------+-------+------------+
1 row in set (0.00 sec)

MariaDB [mahasiswa01]> delete from data_mahasiswa where Nim ='112334406';
Query OK, 1 row affected (0.12 sec)

MariaDB [mahasiswa01]> select*from data_mahasiswa;
+-----------+---------------+---------------+---------------+--------------+----------+----------+-------+------------+
| Nim       | Nama          | Tanggal_lahir | Jenis_kelamin | Alamat_jalan | Kota     | Kode_Pos | No_Hp | Kode_Dosen |
+-----------+---------------+---------------+---------------+--------------+----------+----------+-------+------------+
| 112334401 | Ari Santoso   | 1998-10-12    | Laki-laki     |              | BEKASI   |        0 |       | TI-032     |
| 112334402 | Ario Talib    | 1999-11-16    | Laki-laki     |              | Cikarang |        0 |       | TI-001     |
| 112334404 | Lisa Ayu      | 1996-01-02    | Perempuan     |              | Bekasi   |        0 |       | TL-023     |
| 112334405 | Tiara Wahidah | 1980-02-05    | Perempuan     |              | BEKASI   |        0 |       | TI-010     |
+-----------+---------------+---------------+---------------+--------------+----------+----------+-------+------------+
4 rows in set (0.00 sec)

MariaDB [mahasiswa01]> select*from data_mahasiswa where Tanggal_lahir >= '1996-01-02;
    '> ';
+-----------+-------------+---------------+---------------+--------------+----------+----------+-------+------------+
| Nim       | Nama        | Tanggal_lahir | Jenis_kelamin | Alamat_jalan | Kota     | Kode_Pos | No_Hp | Kode_Dosen |
+-----------+-------------+---------------+---------------+--------------+----------+----------+-------+------------+
| 112334401 | Ari Santoso | 1998-10-12    | Laki-laki     |              | BEKASI   |        0 |       | TI-032     |
| 112334402 | Ario Talib  | 1999-11-16    | Laki-laki     |              | Cikarang |        0 |       | TI-001     |
| 112334404 | Lisa Ayu    | 1996-01-02    | Perempuan     |              | Bekasi   |        0 |       | TL-023     |
+-----------+-------------+---------------+---------------+--------------+----------+----------+-------+------------+
3 rows in set, 1 warning (0.00 sec)

MariaDB [mahasiswa01]> select*from data_mahasiswa where Kota ='Bekasi' and Jenis_kelamin = 'perempuan';
+-----------+---------------+---------------+---------------+--------------+--------+----------+-------+------------+
| Nim       | Nama          | Tanggal_lahir | Jenis_kelamin | Alamat_jalan | Kota   | Kode_Pos | No_Hp | Kode_Dosen |
+-----------+---------------+---------------+---------------+--------------+--------+----------+-------+------------+
| 112334404 | Lisa Ayu      | 1996-01-02    | Perempuan     |              | Bekasi |        0 |       | TL-023     |
| 112334405 | Tiara Wahidah | 1980-02-05    | Perempuan     |              | BEKASI |        0 |       | TI-010     |
+--------
---+---------------+---------------+---------------+--------------+--------+----------+-------+------------+
2 rows in set (0.00 sec)

MariaDB [mahasiswa01]> select nama, kota, Jenis_kelamin, Tanggal_lahir
    -> from data_mahsiswa
    -> where Kota ='Bekasi' and Jenis_Kelamin ='Laki-Laki
    '> or Tanggal_Lahir > 22 and Jenis_Kelamin ='Perempuan'
    '> order by nama;
    '> ';
ERROR 1064 (42000): You have an error in your SQL syntax; check the manual that corresponds to your MariaDB server version for the right syntax to use near 'Perempuan'
order by nama;
;
'' at line 3
MariaDB [mahasiswa01]> select nama, kota, Jenis_kelamin, Tanggal_lahir
    -> from data_mahasiswa
    -> where Kota ='Bekasi' and Jenis_Kelamin ='Laki-Laki'
    -> or Tanggal_Lahir > 22 and Jenis_Kelamin ='Perempuan'
    -> order by Nama;
+---------------+--------+---------------+---------------+
| nama          | kota   | Jenis_kelamin | Tanggal_lahir |
+---------------+--------+---------------+---------------+
| Ari Santoso   | BEKASI | Laki-laki     | 1998-10-12    |
| Lisa Ayu      | Bekasi | Perempuan     | 1996-01-02    |
| Tiara Wahidah | BEKASI | Perempuan     | 1980-02-05    |
+---------------+--------+---------------+---------------+
3 rows in set, 1 warning (0.00 sec)

MariaDB [mahasiswa01]> select nama, Alamat_jalan
    -> from data_mahasiswa;
+---------------+--------------+
| nama          | Alamat_jalan |
+---------------+--------------+
| Ari Santoso   |              |
| Ario Talib    |              |
| Lisa Ayu      |              |
| Tiara Wahidah |              |
+---------------+--------------+
4 rows in set (0.00 sec)

MariaDB [mahasiswa01]> select*from data_mahasiswa order by nama ACS;
ERROR 1064 (42000): You have an error in your SQL syntax; check the manual that corresponds to your MariaDB server version for the right syntax to use near 'ACS' at line 1
MariaDB [mahasiswa01]> select*from data_mahasiswa order by nama ASC;
+-----------+---------------+---------------+---------------+--------------+----------+----------+-------+------------+
| Nim       | Nama          | Tanggal_lahir | Jenis_kelamin | Alamat_jalan | Kota     | Kode_Pos | No_Hp | Kode_Dosen |
+-----------+---------------+---------------+---------------+--------------+----------+----------+-------+------------+
| 112334401 | Ari Santoso   | 1998-10-12    | Laki-laki     |              | BEKASI   |        0 |       | TI-032     |
| 112334402 | Ario Talib    | 1999-11-16    | Laki-laki     |              | Cikarang |        0 |       | TI-001     |
| 112334404 | Lisa Ayu      | 1996-01-02    | Perempuan     |              | Bekasi   |        0 |       | TL-023     |
| 112334405 | Tiara Wahidah | 1980-02-05    | Perempuan     |              | BEKASI   |        0 |       | TI-010     |
+-----------+---------------+---------------+---------------+--------------+----------+----------+-------+------------+
4 rows in set (0.00 sec)

MariaDB [mahasiswa01]> select*from data_mahasiswa order by nama DESC;
+-----------+---------------+---------------+---------------+--------------+----------+----------+-------+------------+
| Nim       | Nama          | Tanggal_lahir | Jenis_kelamin | Alamat_jalan | Kota     | Kode_Pos | No_Hp | Kode_Dosen |
+-----------+---------------+---------------+---------------+--------------+----------+----------+-------+------------+
| 112334405 | Tiara Wahidah | 1980-02-05    | Perempuan     |              | BEKASI   |        0 |       | TI-010     |
| 112334404 | Lisa Ayu      | 1996-01-02    | Perempuan     |              | Bekasi   |        0 |       | TL-023     |
| 112334402 | Ario Talib    | 1999-11-16    | Laki-laki     |              | Cikarang |        0 |       | TI-001     |
| 112334401 | Ari Santoso   | 1998-10-12    | Laki-laki     |              | BEKASI   |        0 |       | TI-032     |
+-----------+---------------+---------------+---------------+--------------+----------+----------+-------+------------+
4 rows in set (0.00 sec)

MariaDB [mahasiswa01]> Bye
Ctrl-C -- exit!

c:\xampp\mysql\bin>
